{
  "schema": "osd-verification-evidence/v1",
  "feature": "agent-runtime-governance-foundation",
  "strategy": "test_first",
  "steps": [
    {"step":"red","command_id":"node-test","exit_code":1,"observed_at":"2026-08-05T00:01:00+08:00","covered_acceptance_criteria":["AC-01","AC-02","AC-03","AC-04","AC-05","AC-06","AC-07","AC-08","AC-11","AC-12","AC-13","AC-14"],"summary":"New runtime-governance test failed because the module did not exist."},
    {"step":"green","command_id":"node-test","exit_code":0,"observed_at":"2026-08-05T00:25:00+08:00","covered_acceptance_criteria":["AC-01","AC-02","AC-03","AC-04","AC-05","AC-06","AC-07","AC-08","AC-09","AC-10","AC-11","AC-12","AC-13","AC-14"],"summary":"Full repository suite passed: 33 tests."}
  ]
}
